{
  "id": "osmf:claim:trial-nct-06974084-studied-long-covid",
  "subject_id": "osmf:trial:nct-06974084",
  "predicate": "studied_in",
  "object_id": "osmf:condition:long-covid",
  "evidence_tier": "C",
  "sources": [
    {
      "type": "nct",
      "value": "NCT06974084"
    },
    {
      "type": "url",
      "value": "https://clinicaltrials.gov/study/NCT06974084"
    }
  ],
  "limitations": "Auto-imported from OSMF Research Tracker clinical_trials JSON. Structural registration link only — not an efficacy grade. Inclusion does not imply study quality, enrollment completeness, or clinical applicability.",
  "status": "draft",
  "reviewed_by": "tracker-import-bot",
  "reviewed_at": "2026-09-19T17:50:46.160Z",
  "license": "CC-BY-4.0"
}
