{
  "id": "osmf:claim:tracker-long-covid-pmid-42380347",
  "subject_id": "osmf:paper:pmid-42380347",
  "predicate": "related_to",
  "object_id": "osmf:condition:long-covid",
  "evidence_tier": "C",
  "sources": [
    {
      "type": "pmid",
      "value": "42380347"
    },
    {
      "type": "url",
      "value": "https://pubmed.ncbi.nlm.nih.gov/42380347/"
    }
  ],
  "limitations": "Auto-imported from OSMF Research Tracker PubMed feed; not human evidence-graded. Inclusion in the tracker query does not imply study quality or clinical applicability.",
  "status": "draft",
  "reviewed_by": "tracker-import-bot",
  "reviewed_at": "2026-09-19T16:57:32.049Z",
  "license": "CC-BY-4.0"
}
