{
  "id": "osmf:claim:agent-repetitive-transcranial-magnetic-stimulation-treats-long-covid",
  "subject_id": "osmf:agent:repetitive-transcranial-magnetic-stimulation",
  "predicate": "treats_candidate_for",
  "object_id": "osmf:condition:long-covid",
  "evidence_tier": "D",
  "sources": [
    {
      "type": "osmf_page",
      "value": "https://research.opensourcemed.info/agents/repetitive-transcranial-magnetic-stimulation/",
      "label": "OSMF Research Tracker (therapeutic agent)"
    },
    {
      "type": "nct",
      "value": "NCT07278206"
    }
  ],
  "limitations": "Key refs: NCT07278206 (RECRUITING). Evaluated from extracted references on 2026-09-19 (Preliminary wave B); not a systematic review. Only ongoing/not-completed trials and no posted results; Preliminary \u2192 D draft. Not medical advice. Tracker Preliminary label is not an OSMF A/B grade.",
  "status": "draft",
  "reviewed_by": "evidence-eval-bot",
  "reviewed_at": "2026-09-19T18:13:34Z",
  "license": "CC-BY-4.0",
  "confidence_notes": "[medium] wave=B Only ongoing/not-completed trials and no posted results; Preliminary \u2192 D draft. | Wave B. Extracted 1 registry trial(s) for Repetitive Transcranial Magnetic Stimulation \u2192 Long COVID: NCT07278206 (RECRUITING, phase=NA, n=66, relevant=True). No posted CT.gov results in this pass. No agent+condition Europe PMC search (wave B/C budget). Honest bar: Preliminary claims stay D/C unless a clear multi-source clinical package is present (not claimed here without verified supportive endpo"
}
