{
  "id": "osmf:claim:agent-vitamin-d-treats-long-covid",
  "subject_id": "osmf:agent:vitamin-d",
  "predicate": "treats_candidate_for",
  "object_id": "osmf:condition:long-covid",
  "evidence_tier": "D",
  "sources": [
    {
      "type": "osmf_page",
      "value": "https://research.opensourcemed.info/agents/vitamin-d/",
      "label": "OSMF Research Tracker (therapeutic agent)"
    },
    {
      "type": "nct",
      "value": "NCT05633472"
    },
    {
      "type": "nct",
      "value": "NCT05630339"
    }
  ],
  "limitations": "Key refs: NCT05633472 (COMPLETED), NCT05630339 (COMPLETED). Evaluated from extracted references on 2026-09-19 (Preliminary wave B); not a systematic review. Some completed condition-related work but phase/size/pubs too thin for C. Not medical advice. Tracker Preliminary label is not an OSMF A/B grade.",
  "status": "draft",
  "reviewed_by": "evidence-eval-bot",
  "reviewed_at": "2026-09-19T18:13:34Z",
  "license": "CC-BY-4.0",
  "confidence_notes": "[medium] wave=B Some completed condition-related work but phase/size/pubs too thin for C. | Wave B. Extracted 2 registry trial(s) for Vitamin D \u2192 Long COVID: NCT05633472 (COMPLETED, phase=NA, n=33, relevant=True); NCT05630339 (COMPLETED, phase=NA, n=150, relevant=True). No posted CT.gov results in this pass. No agent+condition Europe PMC search (wave B/C budget). Honest bar: Preliminary claims stay D/C unless a clear multi-source clinical package is present (not claimed here without veri"
}
