{
  "id": "osmf:claim:agent-pentoxifylline-treats-long-covid",
  "subject_id": "osmf:agent:pentoxifylline",
  "predicate": "treats_candidate_for",
  "object_id": "osmf:condition:long-covid",
  "evidence_tier": "C",
  "sources": [
    {
      "type": "osmf_page",
      "value": "https://research.opensourcemed.info/agents/pentoxifylline/",
      "label": "OSMF Research Tracker (therapeutic agent)"
    },
    {
      "type": "nct",
      "value": "NCT05513560",
      "label": "NCT05513560: RECLAIM: Recovering From COVID-19 Lingering Symptoms Adaptive Integrative Medici"
    },
    {
      "type": "pmid",
      "value": "41715140",
      "label": "PMID 41715140: The RECLAIM adaptive platform trial\u2026 core protocol."
    },
    {
      "type": "pmid",
      "value": "39446164",
      "label": "PMID 39446164: Pentoxifylline in COVID-19 and considerations for its research in long COVID."
    }
  ],
  "limitations": "No arm-level results. Hemorrheologic AE/bleeding considerations. Acute-COVID literature \u2260 PASC treatment. Not medical advice. Tracker Preliminary label is not an OSMF A/B grade.",
  "status": "published",
  "reviewed_by": "evidence-deepdive-bot",
  "reviewed_at": "2026-09-19T19:30:00Z",
  "license": "CC-BY-4.0",
  "confidence_notes": "[high] Deep-dive 2026-09-19 by evidence-deepdive-bot. Prior reviewers: evidence-eval-bot. Tier C retained. Prior C retained."
}
