{
  "id": "osmf:claim:agent-gutmagnific-l-treats-me-cfs",
  "subject_id": "osmf:agent:gutmagnific-l",
  "predicate": "treats_candidate_for",
  "object_id": "osmf:condition:me-cfs",
  "evidence_tier": "D",
  "sources": [
    {
      "type": "osmf_page",
      "value": "https://research.opensourcemed.info/agents/gutmagnific-l/",
      "label": "OSMF Research Tracker (therapeutic agent)"
    },
    {
      "type": "nct",
      "value": "NCT04741841"
    }
  ],
  "limitations": "Key refs: NCT04741841 (COMPLETED). Evaluated from extracted references on 2026-09-19 (Preliminary wave B); not a systematic review. Some completed condition-related work but phase/size/pubs too thin for C. Not medical advice. Tracker Preliminary label is not an OSMF A/B grade.",
  "status": "draft",
  "reviewed_by": "evidence-eval-bot",
  "reviewed_at": "2026-09-19T18:13:34Z",
  "license": "CC-BY-4.0",
  "confidence_notes": "[medium] wave=B Some completed condition-related work but phase/size/pubs too thin for C. | Wave B. Extracted 1 registry trial(s) for Gutmagnific\u2122 L. \u2192 ME/CFS: NCT04741841 (COMPLETED, phase=NA, n=74, relevant=True). No posted CT.gov results in this pass. No agent+condition Europe PMC search (wave B/C budget). Honest bar: Preliminary claims stay D/C unless a clear multi-source clinical package is present (not claimed here without verified supportive endpoints)."
}
