{
  "id": "osmf:claim:agent-ivermectin-treats-long-covid",
  "subject_id": "osmf:agent:ivermectin",
  "predicate": "treats_candidate_for",
  "object_id": "osmf:condition:long-covid",
  "evidence_tier": "D",
  "sources": [
    {
      "type": "osmf_page",
      "value": "https://research.opensourcemed.info/agents/ivermectin/",
      "label": "OSMF Research Tracker (therapeutic agent)"
    },
    {
      "type": "pmid",
      "value": "37302406",
      "label": "PMID 37302406: COVID-OUT long COVID incidence secondary outcome"
    },
    {
      "type": "pmid",
      "value": "36070710",
      "label": "PMID 36070710: COVID-OUT acute severity primary"
    },
    {
      "type": "nct",
      "value": "NCT04510194",
      "label": "NCT04510194: COVID-OUT"
    }
  ],
  "limitations": "Prevention ≠ treatment of established PASC. Observational/anecdotal ivermectin-for-LC claims are uncontrolled. Regulatory/public-health bodies have warned against ivermectin for COVID outside trials. Not medical advice. Tracker Moderate label is not an OSMF A/B grade.",
  "status": "published",
  "reviewed_by": "evidence-deepdive-bot",
  "reviewed_at": "2026-09-19T17:28:00Z",
  "license": "CC-BY-4.0",
  "confidence_notes": "[high] Deep-dive 2026-09-19 by evidence-deepdive-bot. Prior reviewers: evidence-eval-bot. Tier unchanged (D). Prior evidence-eval-bot D retained after primary-source check."
}
