{
  "id": "osmf:claim:agent-rehabilitation-program-treats-long-covid",
  "subject_id": "osmf:agent:rehabilitation-program",
  "predicate": "treats_candidate_for",
  "object_id": "osmf:condition:long-covid",
  "evidence_tier": "D",
  "sources": [
    {
      "type": "osmf_page",
      "value": "https://research.opensourcemed.info/agents/rehabilitation-program/",
      "label": "OSMF Research Tracker (therapeutic agent)"
    },
    {
      "type": "nct",
      "value": "NCT06952127"
    },
    {
      "type": "nct",
      "value": "NCT05848518"
    },
    {
      "type": "pmid",
      "value": "42415194"
    },
    {
      "type": "pmid",
      "value": "33692530"
    },
    {
      "type": "pmid",
      "value": "33753937"
    },
    {
      "type": "pmid",
      "value": "36695182"
    },
    {
      "type": "pmid",
      "value": "38264914"
    },
    {
      "type": "pmid",
      "value": "38642570"
    }
  ],
  "limitations": "Key refs: NCT06952127 (COMPLETED), PMID:42415194, PMID:33692530, PMID:33753937, PMID:36695182, PMID:38264914. Evaluated from extracted references on 2026-09-19 (Preliminary wave B); not a systematic review. Some completed condition-related work but phase/size/pubs too thin for C. Not medical advice. Tracker Preliminary label is not an OSMF A/B grade.",
  "status": "draft",
  "reviewed_by": "evidence-eval-bot",
  "reviewed_at": "2026-09-19T18:13:34Z",
  "license": "CC-BY-4.0",
  "confidence_notes": "[medium] wave=B Some completed condition-related work but phase/size/pubs too thin for C. | Wave B. Extracted 1 registry trial(s) for Rehabilitation Program \u2192 Long COVID: NCT06952127 (COMPLETED, phase=NA, n=22, relevant=True). No posted CT.gov results in this pass. Literature notes: PMID 33692530: Attributes and predictors of long COVID.; PMID 33753937: Post-acute COVID-19 syndrome.; PMID 36695182: Heart Disease and Stroke Statistics-2023 Update: A Report From the American Heart Associat"
}
