{
  "id": "osmf:claim:agent-naltrexone-treats-other-post-viral",
  "subject_id": "osmf:agent:naltrexone",
  "predicate": "treats_candidate_for",
  "object_id": "osmf:condition:other-post-viral",
  "evidence_tier": "D",
  "sources": [
    {
      "type": "osmf_page",
      "value": "https://research.opensourcemed.info/agents/naltrexone/",
      "label": "OSMF Research Tracker (therapeutic agent)"
    },
    {
      "type": "pmid",
      "value": "42060160"
    },
    {
      "type": "nct",
      "value": "NCT04604704"
    }
  ],
  "limitations": "Auto-imported from OSMF Research Tracker therapeutic_agents.json. Evidence Level is tracker metadata, not an OSMF curator grade. Not medical advice; Desk does not provide dosing. Inclusion as a treats_candidate_for claim does not imply efficacy, safety, or clinical recommendation.",
  "status": "draft",
  "reviewed_by": "tracker-import-bot",
  "reviewed_at": "2026-09-19T17:04:30.227Z",
  "license": "CC-BY-4.0"
}
