{
  "id": "osmf:claim:agent-pasc-core-treats-long-covid",
  "subject_id": "osmf:agent:pasc-core",
  "predicate": "treats_candidate_for",
  "object_id": "osmf:condition:long-covid",
  "evidence_tier": "D",
  "sources": [
    {
      "type": "osmf_page",
      "value": "https://research.opensourcemed.info/agents/pasc-core/",
      "label": "OSMF Research Tracker (therapeutic agent)"
    },
    {
      "type": "nct",
      "value": "NCT05965752"
    },
    {
      "type": "nct",
      "value": "NCT05965739"
    },
    {
      "type": "pmid",
      "value": "38611624"
    },
    {
      "type": "pmid",
      "value": "38495306"
    },
    {
      "type": "pmid",
      "value": "38755688"
    },
    {
      "type": "pmid",
      "value": "41212544"
    },
    {
      "type": "pmid",
      "value": "25259891"
    },
    {
      "type": "pmid",
      "value": "29064822"
    },
    {
      "type": "pmid",
      "value": "32761142"
    },
    {
      "type": "pmid",
      "value": "36050306"
    },
    {
      "type": "pmid",
      "value": "38433280"
    }
  ],
  "limitations": "Key refs: NCT05965752 (COMPLETED), PMID:38611624, NCT05965739 (COMPLETED), PMID:38495306, PMID:38755688, PMID:41212544. Evaluated from extracted references on 2026-09-19 (Preliminary wave A); not a systematic review. Some completed condition-related work but phase/size/pubs too thin for C. Not medical advice. Tracker Preliminary label is not an OSMF A/B grade.",
  "status": "draft",
  "reviewed_by": "evidence-eval-bot",
  "reviewed_at": "2026-09-19T18:13:34Z",
  "license": "CC-BY-4.0",
  "confidence_notes": "[medium] wave=A Some completed condition-related work but phase/size/pubs too thin for C. | Wave A. Extracted 2 registry trial(s) for Pasc Core \u2192 Long COVID: NCT05965752 (COMPLETED, phase=NA, n=328, relevant=True); NCT05965739 (COMPLETED, phase=NA, n=328, relevant=True). Posted CT.gov results: yes. Literature notes: PMID 25259891: SDT: a virus classification tool based on pairwise sequence alignment and identity calculation.; PMID 29064822: Advanced capabilities for materials modelling w"
}
